{
  "round": "final",
  "team": "BB-XXX",
  "queries_used": 0,
  "claims": [
    {
      "type": "feature_effect",
      "feature": "x1",
      "direction": "increases",
      "strength": "strong",
      "confidence": 0.0,
      "evidence": {
        "query_ids": [],
        "summary": "Replace this example claim with your own. Every claim needs evidence."
      }
    }
  ]
}
